"conversation_id_str","created_at","favorite_count","full_text","id_str","image_url","in_reply_to_screen_name","lang","location","quote_count","reply_count","retweet_count","tweet_url","user_id_str","username"
"1963558963955601566","Thu Sep 04 11:05:12 +0000 2025","0","Ulasan lengkap mobil listrik BYD Sealion 7 mulai eksterior hingga biaya kepemilikan. https://t.co/Do8F1TFYTQ","1963558963955601566","","","in","","0","0","0","https://x.com/undefined/status/1963558963955601566","3042677100",
"1962820344156401829","Tue Sep 02 10:10:12 +0000 2025","0","Sempat Komplain Kini Pemilik Sealion 7 Puji Habis-habisan Dealer BYD https://t.co/b9WjaWVgiE","1962820344156401829","","","in","","0","0","0","https://x.com/undefined/status/1962820344156401829","80543284",
"1962744345192472834","Tue Sep 02 05:08:12 +0000 2025","1","Masih Ingat BYD Sealion 7 yang Dikomplain Konsumen? Kini Sudah Ditangani https://t.co/YNn5KqL1Ll","1962744345192472834","","","in","","0","0","0","https://x.com/undefined/status/1962744345192472834","80543284",
"1959834130822377487","Mon Aug 25 04:24:03 +0000 2025","0","Setelah sukses dengan BYD Seal pabrikan asal Cina ini membawa BYD Sealion 7 ke Indonesia. Simak perbandingan kedua mobil ini! #IDNTimesAutomotive #BYDSeal #BYDSealion https://t.co/rkAslWeLZM","1959834130822377487","","","in","","0","0","0","https://x.com/undefined/status/1959834130822377487","388190238",
"1959380278033715311","Sat Aug 23 22:20:36 +0000 2025","0","Klarifikasi BYD soal Mobil Listrik Sealion 7 yang Dikeluhkan Konsumen https://t.co/7N1d61CBzg","1959380278033715311","","","in","","0","0","0","https://x.com/undefined/status/1959380278033715311","1605375478952792067",
"1959205224247410742","Sat Aug 23 10:45:00 +0000 2025","2","Konsumen keluhkan BYD Sealion 7 kehilangan tenaga dan bunyi-bunyian. Dealer tanggapi keluhan dan prioritaskan pelayanan aftersales. https://t.co/vL3oh7VRsk","1959205224247410742","","","in","","1","2","0","https://x.com/undefined/status/1959205224247410742","69183155",
"1959183739122229699","Sat Aug 23 09:19:37 +0000 2025","1","Klarifikasi BYD soal Mobil Listrik Sealion 7 yang Dikeluhkan Konsumen https://t.co/AG1Ehi8dFV","1959183739122229699","","","in","","0","0","0","https://x.com/undefined/status/1959183739122229699","80543284",
"1959150743128363035","Sat Aug 23 07:08:31 +0000 2025","0","BYD Sealion 7 Dikeluhkan Konsumen: Tenaga Hilang Muncul Bunyi-bunyian https://t.co/kh6NuQalAv","1959150743128363035","","","in","","0","0","0","https://x.com/undefined/status/1959150743128363035","80543284",
"1958138731455734216","Wed Aug 20 12:07:08 +0000 2025","0","SUV ramah lingkungan BYD Sealion 7 Hybrid bakal dijual dengan harga kompetitif ini bocoran spesifikasinya https://t.co/SnyKzYJc27","1958138731455734216","","","in","","0","0","0","https://x.com/undefined/status/1958138731455734216","1450324371583553538",
"1956666530374263030","Sat Aug 16 10:37:08 +0000 2025","2","Semangat turnamen semangat inovasi! Turnamen seru + Mobil listrik futuristik Temukan BYD Sealion 7 langsung di Losdoll Padel Tournament 2025 Topspin Arena Makassar! #BYDHAKAKarebosi #BYDSealion7 #LosdollPadelTournament https://t.co/4FRwMXUpqJ","1956666530374263030","https://pbs.twimg.com/amplify_video_thumb/1956666440758816768/img/Hgv8MvWEypJFaNdh.jpg","","in","","0","0","0","https://x.com/undefined/status/1956666530374263030","1946400906326786048",
"1956653409953886320","Sat Aug 16 09:45:00 +0000 2025","0","Sepanjang 2025 20.795 unit mobil CBU dari BYD masuk ke Indonesia. BYD M6 dan Sealion 7 jadi andalan utamanya! https://t.co/hGlnLe4Lct","1956653409953886320","","","in","","0","0","0","https://x.com/undefined/status/1956653409953886320","350668803",
"1954101113617002791","Sat Aug 09 13:06:49 +0000 2025","5","@pengennyetir @hendriprabowo @gnugaifaar @SuzukiIndonesia Aku blm pernah cobain Brio tapi pernah coba Agya old masih enakan ini pernah bawa Wuling Air EV masih enakan ini juga. Driving experience-nya align dgn mobil BYD lainnya yg pernah kucobain: Atto 3 dan Sealion 7.","1954167482224136623","","pengennyetir","in","","1","1","0","https://x.com/undefined/status/1954167482224136623","135542078",
"1950740415583322155","Thu Jul 31 03:52:01 +0000 2025","3","@tannyania @innovacommunity GIIAS lokasinya di Tangerang. target marketnya orang Jabodetabek yang demen ganti mobil. liat aja jalanan jakarta gw lebih sering liat BYD Seal Sealion 7 Wuling Air EV dibanding Avanza 2015 yang udah pada lari ke daerah selain Jabodetabek","1950766372197404822","","tannyania","in","","0","0","0","https://x.com/undefined/status/1950766372197404822","1156499330670313473",
"1949335739252011266","Sun Jul 27 05:07:55 +0000 2025","0","Antusiasme kalian luar biasa dari yang penasaran sama Sealion 7 sampai yang jatuh hati sama Wuling Cloud EV Sampai jumpa di event seru selanjutnya! BNI finance siap bantu wujudkan mobil impianmu __ #CustomerGathering #TestDriveExperience #BNI #BNIfinance #BYD #Wuling","1949335923050582204","","bnifinance","in","","0","0","0","https://x.com/undefined/status/1949335923050582204","1612467574461304833",
"1944563890731573531","Mon Jul 14 01:05:34 +0000 2025","0","Denza D9 jadi mobil listrik dengan wholesales terbanyak sepanjang Juni 2025 disusul BYD Sealion 7 dan M6 https://t.co/nupE5P6Y1U","1944563890731573531","","","in","","0","0","0","https://x.com/undefined/status/1944563890731573531","1450324371583553538",
"1943958386611302470","Sat Jul 12 08:59:31 +0000 2025","0","Lagi di fase pengen punya rumah 12M mobil BYD Sealion 7 sama pengen terjun payung dari ketinggian 10ribu kaki","1943958386611302470","","","in","","0","0","0","https://x.com/undefined/status/1943958386611302470","1303125798941945856",
"1941682614437589385","Sun Jul 06 02:25:46 +0000 2025","0","@itsmaewka Haha iya biar bs jdiin nongbeenya princess passenger Ad yg pernah nebak kl g salah byd sealion 7 tp bs jd bener soalnya psun blg fa belinya mobil listrik kan.","1941684971296653440","","itsmaewka","in","","0","1","0","https://x.com/undefined/status/1941684971296653440","1832187209937776640",
"1938834433207083376","Sat Jun 28 11:56:40 +0000 2025","9","@innovacommunity Sampai saat ini pakai Sealion 7 enak2 aja minnov tarikannya instan beda sama ICE relatif lebih canggih dan mewah dibanding harga mobil lain yang sama yang pasti bebas ganjil genap. Baru kemaren ngobrol sama teman RRT mobil BYD disana sangat terkenal dia mau beli Denza D9 di Jkt","1938929539075522682","","innovacommunity","in","","0","1","0","https://x.com/undefined/status/1938929539075522682","1570287477751189505",
"1934784118497419622","Tue Jun 17 01:24:15 +0000 2025","0","Sedan listrik premium ini menjadi pilihan favorit banyak orang bukan hanya karena performanya yang luar biasa tetapi juga karena harganya yang tergolong kompetitif di kelasnya. https://t.co/1qmFh2h5cb","1934784118497419622","","","in","","0","0","0","https://x.com/undefined/status/1934784118497419622","350668803",
"1934416928870973639","Mon Jun 16 01:05:10 +0000 2025","0","Pengiriman mobil listrik secara wholesales tembus 6.331 unit di Mei 2025 BYD Sealion 7 kontributor utama https://t.co/eqdYtMye9O","1934416928870973639","","","in","","0","0","0","https://x.com/undefined/status/1934416928870973639","1450324371583553538",
"1934133751954677925","Sun Jun 15 06:19:55 +0000 2025","0","*nunggu mobil sekelas byd sealion 7 harga 200jtan*","1934133751954677925","","","in","","0","0","0","https://x.com/undefined/status/1934133751954677925","155473258",
"1934100509906096482","Sun Jun 15 04:07:50 +0000 2025","0","BYD Song Plus #byd https://t.co/1fILdmkNu4 https://t.co/te6lf89TTl","1934100509906096482","https://pbs.twimg.com/ext_tw_video_thumb/1934100485189029888/pu/img/LwQ9r7n1o5tpJdEX.jpg","","cy","","0","0","0","https://x.com/undefined/status/1934100509906096482","738356017801531392",
"1934096102082707658","Sun Jun 15 03:50:19 +0000 2025","0","Mobil Listrik BYD M6 #byd #mobillistrik Beli disini https://t.co/sx6AUGEmUY https://t.co/RdewvtzYzd","1934096102082707658","https://pbs.twimg.com/ext_tw_video_thumb/1934096054385102848/pu/img/7fcc3ad5P1n_Jpn1.jpg","","ht","","0","0","0","https://x.com/undefined/status/1934096102082707658","738356017801531392",
"1929145420778717444","Tue Jun 03 02:08:27 +0000 2025","0","@innovacommunity Market EV akan sama dg di China saling kanibal merk/jenis mobil brand atau perusahaan sendiri...disana udah kejadian BYD Sealion 7 keluar eh ga lama Sealion 7 DMi keluar yg PHEV bisa 1300km ","1929721814923845742","","innovacommunity","in","","0","0","0","https://x.com/undefined/status/1929721814923845742","837431856",
"1926218881493868582","Mon May 26 01:35:57 +0000 2025","2","@eddie_rahper @innovacommunity Harga mobil listrik terlaris di Indonesia (April 2025 dalam juta IDR): 1. BYD Sealion 7: 629-719 2. BYD M6: 383-433 3. Chery iCar (J6): 505.5-608 4. Denza D9: 950 5. Wuling Air EV: 184-307.5 6. Geely EX5: 465-505 7. Aion Hypertec HT: 600-700 8. Wuling Bingo EV:","1926814531323416589","","eddie_rahper","in","","0","0","0","https://x.com/undefined/status/1926814531323416589","1720665183188922368",
"1925733546389291070","Fri May 23 02:00:30 +0000 2025","2","Menjajal 2 Mobil Listrik Bertenaga Buas BYD Seal dan Sealion 7 di Sirkuit Mandalika Begini Performanya https://t.co/3F9TO7amyl","1925733546389291070","","","in","","0","0","0","https://x.com/undefined/status/1925733546389291070","132078023",
"1925394651198165255","Thu May 22 03:33:51 +0000 2025","0"," *FYP with MTF x BYD Harmony Slipi* _Find Your Promo &amp; Fun Your Purchase_ *TikTok Live Spesial:* Intip BYD Sealion 7 bersama MTF️ Penasaran kenapa mobil listrik BYD makin digemari? Yuk kita bedah langsung fitur-fitur Cons.. https://t.co/bcYUYZT4CI https://t.co/v7ObJCTlxw","1925394651198165255","https://pbs.twimg.com/media/GrhgOBvboAAvQNp.jpg","","in","","0","0","0","https://x.com/undefined/status/1925394651198165255","786333896",
"1925183326274429025","Wed May 21 13:34:07 +0000 2025","0","Inilah fitur keunggulan BYD Sealion 7 SUV mobil listrik premium yang menawarkan performa tinggi desain sporty dan teknologi canggih. https://t.co/F3zCMgYAkD","1925183326274429025","","","in","","0","0","0","https://x.com/undefined/status/1925183326274429025","1404018642",
"1925100073546834043","Wed May 21 08:03:18 +0000 2025","0","Penjualan mobil listrik April 2025 didominasi BYD Sealion 7 dengan lonjakan signifikan. Lihat daftar lengkap 10 mobil listrik terlaris. https://t.co/wMNsgZf9Nn","1925100073546834043","","","in","","0","0","0","https://x.com/undefined/status/1925100073546834043","1404018642",
"1924321916942237862","Mon May 19 04:31:11 +0000 2025","0","BYD Sealion 7 Rajai Penjualan Mobil Listrik di Indonesia https://t.co/ffxqN3k6hr https://t.co/VH4drRCE1q","1924321916942237862","https://pbs.twimg.com/media/GrSQlgYWgAABrxi.jpg","","in","","0","0","0","https://x.com/undefined/status/1924321916942237862","118371948",
"1924303531278029137","Mon May 19 03:18:08 +0000 2025","0","Daftar 10 Mobil Listrik Terlaris April 2025 BYD Sealion 7 Juara https://t.co/FV5JQlfXNq","1924303531278029137","","","in","","0","0","0","https://x.com/undefined/status/1924303531278029137","118646322",
"1923307182495551535","Fri May 16 09:19:00 +0000 2025","0","Posisi Kijang Innova di puncak daftar mobil terlaris belum goyah. Innova masih unggul dari para rivalnya di Indonesia! 🇮🇩⁣ &gt;&gt; https://t.co/tbNmrggHKk ⁣ #detikOto https://t.co/uZFVCSK1wd","1923307182495551535","https://pbs.twimg.com/media/GrDn4zTaEAAIoTt.jpg","","in","","0","0","0","https://x.com/undefined/status/1923307182495551535","80543284",
"1923232440190935250","Fri May 16 04:22:00 +0000 2025","0","Posisi Kijang Innova di puncak daftar mobil terlaris belum goyah. Innova masih unggul dari para rivalnya di Indonesia. https://t.co/Ivsfcdmw3o","1923232440190935250","","","in","","0","0","1","https://x.com/undefined/status/1923232440190935250","69183155",
"1922947818840260883","Thu May 15 09:31:01 +0000 2025","2","Persaingan mobil listrik di Indonesia semakin ketat terlihat dari data penjualan April 2025 yang menunjukkan BYD Sealion 7 jadi mobil listrik terlaris diikuti BYD M6 dan Chery J6 yang juga laris di pasar. Simak selengkapnya: https://t.co/3d2wo0fVQg https://t.co/jtHeNZANqX","1922947818840260883","https://pbs.twimg.com/media/Gq-uFPCWQAAIo9a.jpg","","in","","0","0","1","https://x.com/undefined/status/1922947818840260883","1582972008479920129",
"1922929342369366457","Thu May 15 08:17:36 +0000 2025","0","20 Mobil Terlaris di RI April 2025: Innova di Pucuk BYD Sealion 7 Bikin Kejutan https://t.co/HjmzDhSYKO","1922929342369366457","","","in","","0","0","0","https://x.com/undefined/status/1922929342369366457","80543284",
"1922840989904855147","Thu May 15 02:26:31 +0000 2025","0","Mobil Terlaris April: Innova Juara BYD Sealion 7 Mulai Nyetrum https://t.co/mRsDUfy2Vy","1922840989904855147","","","in","","0","0","1","https://x.com/undefined/status/1922840989904855147","1582972008479920129",
"1922656501291704604","Wed May 14 14:13:25 +0000 2025","0","Baru dapat info Mobil Terlaris April 2025: Toyota Kijang Innova: 4.588 unit Daihatsu Sigra: 4.020 unit Toyota Avanza: 2.595 unit Honda Brio: 2.174 unit Toyota Rush: 2.019 unit BYD Sealion 7: 1.793 unit Suzuki Carry PU: 1.773 unit Daihatsu Ayla: 1.564 unit Apa benar ekonomi sulit?","1922656501291704604","","","in","","0","0","0","https://x.com/undefined/status/1922656501291704604","383114904",
"1919361447273832693","Mon May 05 12:00:03 +0000 2025","1","Kapan lagi bisa taxi ride mobil canggih masa depan? Di kumparan New Energy Vehicle Summit 2025 kamu bisa naik BYD Sealion 7 &amp; BYD Denza mobil hidrogen yang senyap nyaman dan super ramah lingkungan! Duduk santai di kursi penumpang sambil menjajal teknologi hidrogen https://t.co/1HW6uNbReI","1919361447273832693","https://pbs.twimg.com/media/GqLn-CMakAA52gk.jpg","","in","","0","0","0","https://x.com/undefined/status/1919361447273832693","759692754985242625",
"1918260819059720564","Fri May 02 11:06:33 +0000 2025","0","BYD Sealion 7 hybrid dipersiapkan meluncur di negara asalnya di Indonesia baru ada versi listrik murni https://t.co/Rq8XUvvvlE","1918260819059720564","","","in","","0","0","0","https://x.com/undefined/status/1918260819059720564","1450324371583553538",
"1916888040917839988","Mon Apr 28 16:11:37 +0000 2025","0","Temukan Otoproject Karpet Mobil Maxmat 7D Luxliner BYD SEALION 7 2025 AT / ELECTRIC VEHICLE seharga Rp435.627. Dapatkan sekarang juga di Shopee! https://t.co/bgeAFawcf0","1916888040917839988","","","in","","0","0","0","https://x.com/undefined/status/1916888040917839988","251598820",
"1915277418849333684","Thu Apr 24 05:31:35 +0000 2025","0","BYD kuasai daftar mobil listrik terlaris di Indonesia per Maret 2025. Denza D9 M6 dan Sealion 7 pimpin pasar Hyundai tertinggal jauh. https://t.co/my4kmPhCA9","1915277418849333684","","","in","","0","0","0","https://x.com/undefined/status/1915277418849333684","1404018642",
"1913379910095364375","Fri Apr 18 23:51:34 +0000 2025","0","Ada mobil BYD Sealion 7 mau masuk tol tapi pas tap emoney tulisane: SALDO KURANG.","1913379910095364375","","","in","","0","0","0","https://x.com/undefined/status/1913379910095364375","170144877",
"1912828189195551202","Thu Apr 17 11:19:13 +0000 2025","0","BYD Sealion 7 merupakan salah satu mobil sedan listrik premium saat ini. Simak harga BYD Sealion 7 Premium terbaru 2025 di bawah ini! https://t.co/2aMnYMNbU2","1912828189195551202","","","in","","0","0","0","https://x.com/undefined/status/1912828189195551202","350668803",
"1912026249355985404","Tue Apr 15 06:12:36 +0000 2025","2","Btw gw mau beli mobil listrik Bang @sicupuh. Menurut lu bagusan mana buat PP Bogor-Jaksel? Pilihannya sudah mengerucut ke BYD Sealion 7 Ioniq 5 atau Kona? Butuhnya buat mobil capek aja?","1912026249355985404","","","in","","0","1","0","https://x.com/undefined/status/1912026249355985404","94275536",
"1911994491998978489","Tue Apr 15 04:06:24 +0000 2025","0","Alhamdulillah punya mobil baru. BYD SEALION 7 adalah mobil listrik yang stylish dan canggih dengan desain yang elegan dan teknologi yang mutakhir. Semoga mobil baru Anda membawa kebahagiaan dan kemudahan dalam berkendara. https://t.co/9wDXhIGWrN","1911994491998978489","https://pbs.twimg.com/media/GojE24FWUAEdC4i.jpg","","in","","0","1","0","https://x.com/undefined/status/1911994491998978489","550534628",
"1911206634745184725","Sat Apr 12 23:55:44 +0000 2025","0","Asyikkkkkkkk. Alhamdulillah bisa beli mobil BYD Sealion 7 baru lagi.","1911206634745184725","","","in","","0","0","0","https://x.com/undefined/status/1911206634745184725","550534628",
"1911004099748782081","Sat Apr 12 10:30:56 +0000 2025","0","Dibekali Fitur Canggih BYD Sealion 7 Peroleh Lima Bintang dalam Uji Keselamatan ANCAP https://t.co/qUq4Xdgboi","1911004099748782081","","","in","","0","0","0","https://x.com/undefined/status/1911004099748782081","1578222594",
"1910230323478282297","Thu Apr 10 07:16:14 +0000 2025","1","Kenapa BYD Sealion 7 Jadi Primadona Baru Mobil Listrik di Serpong? | Artikel - https://t.co/UI6LsMKEmb https://t.co/d9jALn29oe","1910230323478282297","","","in","","0","0","0","https://x.com/undefined/status/1910230323478282297","1651120245124521986",
"1904016821214437595","Mon Mar 24 03:45:59 +0000 2025","0","Pengen bgt mobil BYD Sealion 7 Semoga tahun depan ke beli.. kalau ga itu Mazda CX5 atau any Benz SUV model ‍️","1904016821214437595","","","in","","0","0","0","https://x.com/undefined/status/1904016821214437595","2656665848",
"1904007191088202224","Mon Mar 24 03:07:43 +0000 2025","0","Dengan harga yang cukup terjangkau mobil ini hadir dengan berbagai spesifikasi canggih dan fitur-fitur unggulan yang siap bersaing di pasar mobil listrik Indonesia. https://t.co/19RsfxN9wB","1904007191088202224","","","in","","0","0","0","https://x.com/undefined/status/1904007191088202224","350668803",
"1901537874090270880","Mon Mar 17 07:35:32 +0000 2025","0","https://t.co/imTLbcbIsG","1901537874090270880","","","zxx","","0","0","0","https://x.com/undefined/status/1901537874090270880","3245882905",
"1897916146143330806","Fri Mar 07 15:22:27 +0000 2025","0","@WalterWisnu Jangan dah. Atpm nya serem. Bisa putus tiba tiba dia nanti. Kalo mau beli mobil listrik byd wuling chery. Udah 3 itu aja nu. Wkwkw BYD sealion 7 itu keren sekali. 700an tapi. Mehong. 400 tinggi bisa ke chery j6. Mantap. Gagah.","1898031499213258781","","WalterWisnu","in","","0","0","0","https://x.com/undefined/status/1898031499213258781","53030515",
"1896465846773633241","Mon Mar 03 07:41:07 +0000 2025","0","Sport Car Berbaju SUV Begini Rasanya Geber BYD Sealion 7 ke Bandung https://t.co/ZwJzfNn2e7","1896465846773633241","","","in","","0","0","0","https://x.com/undefined/status/1896465846773633241","80543284",
"1896446692142043137","Mon Mar 03 06:25:00 +0000 2025","0","BYD Indonesia mengajak media mencoba SUV listrik terbarunya Sealion 7. Tim Carmudi menjajal varian tertinggi Performance di rute Jakarta Bandung Jakarta. Performa impresif kabin nyaman tapi tetap ada catatan untuk mobil Rp 719 juta ini. #carmudiindonesia #byd https://t.co/IT1eGtaIcO","1896446692142043137","https://pbs.twimg.com/media/GlFLF9fbYAA1V_y.jpg","","in","","0","0","0","https://x.com/undefined/status/1896446692142043137","2241947264",
"1895432686606455233","Fri Feb 28 11:15:42 +0000 2025","0","Begini Rasa Berkendara BYD Sealion 7 Rute Jakarta-Bandung-Jakarta: Crossover Sporty yang Nyaman https://t.co/JHzHQJ2Myd","1895432686606455233","","","in","","0","0","0","https://x.com/undefined/status/1895432686606455233","1578222594",
"1895393161067008353","Fri Feb 28 08:38:38 +0000 2025","0","Menjajal Mobil Listrik Bertenaga Sangar BYD Sealion 7 Begini Akselerasi dan Ketangguhannya https://t.co/nsXrilynMl","1895393161067008353","","","in","","0","0","0","https://x.com/undefined/status/1895393161067008353","132078023",
"1895056480518168896","Thu Feb 27 10:20:48 +0000 2025","0","Di Australia BYD Sealion 7 Terpesan Hingga 1.000 Unit https://t.co/cuf62TFsIU","1895056480518168896","","","tl","","0","0","0","https://x.com/undefined/status/1895056480518168896","1578222594",
"1895037741676499283","Thu Feb 27 09:06:20 +0000 2025","0","Di Austsralia BYD Sealion 7 Terpesan Hingga 1.000 Unit https://t.co/4wzzOU6rbD","1895037741676499283","","","in","","0","0","0","https://x.com/undefined/status/1895037741676499283","1578222594",
"1895017488410386826","Thu Feb 27 07:45:51 +0000 2025","0","BYD Targetkan Konsumen Bisa Mudik Pakai Sealion 7 https://t.co/5NMiAaTOqE","1895017488410386826","","","in","","0","0","0","https://x.com/undefined/status/1895017488410386826","80543284",
"1894955287557357930","Thu Feb 27 03:38:41 +0000 2025","0","Pakai Platform Sama Apa yang Bikin BYD Sealion 7 Beda dengan Seal? https://t.co/KWjs2aFyrN","1894955287557357930","","","in","","0","0","0","https://x.com/undefined/status/1894955287557357930","80543284",
"1894938520332251377","Thu Feb 27 02:32:04 +0000 2025","0","Bertenaga Sangar Intip Perbedaan BYD Sealion 7 Performance dan Premium https://t.co/OJ6h0VpDEg","1894938520332251377","","","in","","0","0","0","https://x.com/undefined/status/1894938520332251377","132078023",
"1894762710715486296","Wed Feb 26 14:53:27 +0000 2025","1","Dominasi Penjualan di IIMS 2025 BYD Ungkap Sealion 7 Dikirim ke Konsumen Sebelum Lebaran https://t.co/VHdBzWYPFP","1894762710715486296","","","in","","0","0","0","https://x.com/undefined/status/1894762710715486296","132078023",
"1894649946424410341","Wed Feb 26 07:25:22 +0000 2025","0","Utamakan Kenyamanan Berkendara BYD Sealion 7 Bakal Dijajal dari Jakarta ke Bandung Hari Ini https://t.co/BmCkUiNm5e","1894649946424410341","","","in","","0","0","0","https://x.com/undefined/status/1894649946424410341","1578222594",
"1893570548351037678","Sun Feb 23 07:56:14 +0000 2025","0","Harga Mulai Rp 600 Jutaan Begini Garansi BYD Sealion 7 https://t.co/tK6h6BKev9","1893570548351037678","","","in","","0","0","0","https://x.com/undefined/status/1893570548351037678","80543284",
"1893290989084909920","Sat Feb 22 13:25:22 +0000 2025","0"," BYD Sealion 7 Kuasai IIMS 2025! Model mobil listrik terbaru ini mendominasi 50% penjualan di IIMS 2025 berkat test drive eksklusif yang memukau. Temukan detail selengkapnya di: https://t.co/Y2Blgrd4eh #BYD #Sealion7 #IIMS2025 #MobilListrik https://t.co/2jwS5BBL7s","1893290989084909920","https://pbs.twimg.com/media/GkZR27gXoAA6jd9.jpg","","in","","0","0","0","https://x.com/undefined/status/1893290989084909920","1869760512575389697",
"1892819302124048602","Fri Feb 21 06:11:03 +0000 2025","0","Harga Beda Rp 7 Juta Pilih Beli BYD Seal atau Sealion 7? https://t.co/Q0WJzH7qUh","1892819302124048602","","","in","","0","0","0","https://x.com/undefined/status/1892819302124048602","80543284",
"1892765165528945126","Fri Feb 21 02:35:55 +0000 2025","0","Ini Ragam Fitur Unggulan yang Ditawarkan BYD Sealion 7 https://t.co/HN0luSluhO","1892765165528945126","","","in","","0","0","0","https://x.com/undefined/status/1892765165528945126","1578222594",
"1892049358834610258","Wed Feb 19 03:11:34 +0000 2025","2","BYD Sealion 7 dibanderol mulai Rp 629 juta hingga yang termahal Rp 719 juta. Kalau dipinang dengan skema kredit berapa ya cicilannya tiap bulan? https://t.co/S76oF1Ih28","1892049358834610258","","","in","","0","0","1","https://x.com/undefined/status/1892049358834610258","69183155",
"1892010132378427741","Wed Feb 19 00:35:42 +0000 2025","0","Mau Kredit BYD Sealion 7? Segini Besar Cicilannya Tiap Bulan https://t.co/gPiThKN5zQ","1892010132378427741","","","in","","0","0","0","https://x.com/undefined/status/1892010132378427741","80543284",
"1891874781940662322","Tue Feb 18 15:37:52 +0000 2025","22","Oke fix kalo beli mobil listrik pertama bakal pilih BYD sealion 7. Sekarang udah kekumpul 300 ribu ","1891874781940662322","","","in","","2","3","3","https://x.com/undefined/status/1891874781940662322","197403921",
"1891694263513100790","Tue Feb 18 03:40:33 +0000 2025","0","BYD Sealion 7 Usung Teknologi Canggih ITAC Intip Keunggulannya https://t.co/6Cx4jqhTo3","1891694263513100790","","","in","","0","0","0","https://x.com/undefined/status/1891694263513100790","1578222594",
"1891485975303397705","Mon Feb 17 13:52:53 +0000 2025","0","Masih dalam suasana IIMS 2025 mobil listrik BYD Sealion 7 jadi primadona pengunjung. Apa alasannya? Dan bagaimana spesifikasi dari mobil listrik ini? Tonton sekarang juga https://t.co/fshDljOrfd","1891485975303397705","","","in","","0","0","0","https://x.com/undefined/status/1891485975303397705","1339552176817885186",
"1891463815356649817","Mon Feb 17 12:24:49 +0000 2025","1","BYD menambah lini produknya di Indonesia dengan kehadiran Sealion 7. Ini daftar mobil BYD yang dijual di Indonesia! ️⁣ ⁣ #detikoto #byd #buildyourdream https://t.co/qTSsZImJgn","1891463815356649817","https://pbs.twimg.com/media/Gj_UTvAbEAAJR2t.jpg","","in","","0","1","3","https://x.com/undefined/status/1891463815356649817","80543284",
"1891431889879302504","Mon Feb 17 10:17:58 +0000 2025","0","2 Teknologi Unggulan di BYD Sealion 7 Mengemudi Makin Aman dan Nyaman https://t.co/cxary9WXbi","1891431889879302504","","","in","","0","0","0","https://x.com/undefined/status/1891431889879302504","80543284",
"1891308789552537904","Mon Feb 17 02:08:48 +0000 2025","0","Tambah Sealion 7 Ini Daftar Mobil BYD yang Dijual di Indonesia https://t.co/Ig1MqE6qxd","1891308789552537904","","","in","","0","0","0","https://x.com/undefined/status/1891308789552537904","80543284",
"1890908754239000807","Sat Feb 15 23:39:13 +0000 2025","0","Mobil Listrik BYD Sealion 7 Hadir dengan Harga Fantastis https://t.co/FF6Vto604D","1890908754239000807","","","in","","0","0","0","https://x.com/undefined/status/1890908754239000807","239873274",
