"conversation_id_str","created_at","favorite_count","full_text","id_str","image_url","in_reply_to_screen_name","lang","location","quote_count","reply_count","retweet_count","tweet_url","user_id_str","username"
"1860956759155982544","Mon Nov 25 08:00:40 +0000 2024","0","Aion V Mobil listrik yang cocok diajak berpetualang. Info &amp; Pemesanan Angga JP 0811-96-999-76 Indomobil Aion #AionV #GJAW2024 #MobilBaru #ElectricVehicle #BukanSalesBiasa https://t.co/3t1yNlu1gt","1860956759155982544","https://pbs.twimg.com/ext_tw_video_thumb/1860956653065256960/pu/img/KuEUgk5Ees-cg2iy.jpg","","in","","0","0","0","https://x.com/undefined/status/1860956759155982544","1276165398946349061",
"1860911529929195694","Mon Nov 25 05:00:57 +0000 2024","0","Model Terbaru Aion V Berwajah T-Rex Diperkenalkan di GJAW 2024 #uzoneID #mobil #motor https://t.co/xMY04NFj1e","1860911529929195694","","","in","","0","0","0","https://x.com/undefined/status/1860911529929195694","1675707294",
"1860274994758189349","Sat Nov 23 10:51:35 +0000 2024","0","Aion V Harga pre-book under 499 Juta lengkap dengan massage seat refrigerator &amp; warmer pada center consol banyak pilihan warna eksterior dan interior. Mobil ini cocok untuk kamu! Info &amp; Pemesanan Angga JP 0811-96-999-76 Indomobil Aion #AionV #ElectricVehicle #GJAW2024 https://t.co/Q1tuwMvs5W","1860274994758189349","https://pbs.twimg.com/ext_tw_video_thumb/1860274975514701824/pu/img/__iMY_RPsyp26uFF.jpg","","in","","0","0","1","https://x.com/undefined/status/1860274994758189349","1276165398946349061",
"1860185176464368100","Sat Nov 23 04:54:41 +0000 2024","1","Aion V Melantai di GJAW 2024 Unik Ada Kursi Pijat Pendingin dan Pemanas Minuman https://t.co/4N5HgaZQ5Y","1860185176464368100","","","in","","0","0","0","https://x.com/undefined/status/1860185176464368100","132078023",
"1859890501312545069","Fri Nov 22 09:23:45 +0000 2024","0","Aion Indonesia resmi memperkenal mobil SUV elektrik terbarunya Aion V. Mobil ini sudah bisa dipesan dengan harga pre-book under 499 Rupiah. Ayo siapa yang tertarik hubungi nomor dibawah ya! Info &amp; Pemesanan : Angga JP 0811-96-999-76 Indomobil Aion Cr: IG Autonetmagz https://t.co/EqZqWZynjz","1859890501312545069","https://pbs.twimg.com/ext_tw_video_thumb/1859890393586044930/pu/img/QWkXBGIj_InQiBgF.jpg","","in","","0","0","0","https://x.com/undefined/status/1859890501312545069","1276165398946349061",
"1812372611575562736","Sun Jul 14 06:24:37 +0000 2024","0","Review mobil listrik Aion Y Plus Info &amp; Pemesanan Angga JP 0811-96-999-76 Indomobil Aion https://t.co/RrrSGJrTvB","1812372611575562736","","","in","","0","0","1","https://x.com/undefined/status/1812372611575562736","1276165398946349061",
"1803797743036715220","Thu Jun 20 23:27:02 +0000 2024","0","Ulasan mobil listrik GAC AION Y Plus https://t.co/J44JGVybSV","1803932602967204275","","AutonetMagz","in","","0","0","0","https://x.com/undefined/status/1803932602967204275","1216879388",
"1799356394153677124","Sat Jun 08 08:23:50 +0000 2024","1","Buat yang penasaran dengan mobil listrik GAC AION Y Plus yuk nonton first impression review nya https://t.co/J44JGVybSV","1799356650790515031","","AutonetMagz","in","","0","0","0","https://x.com/undefined/status/1799356650790515031","1216879388",
"1796064018580521124","Thu May 30 06:20:05 +0000 2024","0","Keren! Rancang Kendaraan Impian Masa Depan Ini Penampakan Mobil Terbang Dari GAC AION https://t.co/RDmICdR2UF","1796064018580521124","","","in","","0","0","0","https://x.com/undefined/status/1796064018580521124","231355136",
